text,title,char_count,word_count,clean_titles,target
"Hi, I am a lady. I've been in the security industry for about 5 years now for various companies, agencies and in house.

And 100% of these fucking companies don't wanna pay extra for ladies to have ladies cut uniform pants. They just stick us in the fucking mens pants, completely ignorant of the fact that we have wide hips, thicc thighs, and a goddamn booty.So I'm sitting here in my computer chair man-spreading with like 8 inches of ankle exposed because sitting normally gives me hella camel toe, and I have this large area of fabric below my belt above my snatch like a fucking fanny pack.I know yall have dicks that would fill some of that space, but all this excess space is parallel to my fuckin belt.

So the question is, looking at that fabric, do yall tuck your dick parallel to your belts? Do you deal with constant front wedgies? Do the pants actually wear like their supposed to because yall dont have fuckin baby making hips? Do you use that fanny pack fabric for beer belly? How do you use pockets if you're large?",Whats the deal with pants?,26,5,what deal pant,0
"My ex-girlfriend and I have been broken up for a year and a half. While I can say I'm objectively ""over"" her, I still have yet to have those super fuzzy feelings you get for someone when you really like them. I've at best had very fleeting feelings for crushes over the last year or so. What was that moment like when you finally moved on from your past love?",Can you describe the moment when you got over the girl you never thought you'd get over?,88,17,can describ moment got girl never thought get,0
"Guys I dont get why there is actually some people that are ready to go out there to buy a 19 year olds bathwater for 30 bucks a pop.

Like I just would like the reason why you would do it?",Why buy Belle Delphines bath water?,35,6,whi buy bell delphin bath water,0
"I'm married, going on 4 years now and seeing that my wife &amp; I don't have as much in common as I thought.","What's been concerning you lately, in your personal life?",57,9,what concern late person life,0
"I'm 17 about to be a senior in highschool and in march of next year turning 18 

I'm about to get the boot, and I don't know what to do-how do I move out with little to no money and no car?",How to move out at 18?,22,6,how move,0
What can your partner say to make you feel less ashamed? Facing this issue with my current partner - I want to make him feel better/more comfortable when it happens,"Men, what do you want to hear when you finish a little too soon in bed?",71,16,men want hear finish littl soon bed,0
,"Like in actions tv shows/movies, how would one guy realistically beat up a bunch of other guys ganging up on him with (fist fight, no weapons)?",143,26,like action tv show movi would one guy realist beat bunch guy gang fist fight weapon,0
,What was the last message you sent/ they sent before you got ghosted/ghost them?,80,14,what last messag sent sent got ghost ghost,0
"I’m curious, I wanna make the guys I sext with feel desired and wanted, while staying genuine (not gonna tell a guy with an average sized dick that it’s the biggest I’ve ever seen).",What are your favorite responses to nudes?,42,7,what favorit respons nude,0
We have been together for a while and I never asked about how it all ended previously. He knows how mine ended.I don't know if this is something I should avoid talking about. Is there a specific way to go on about it ?,Is it good in anyway to ask my sigoth(M) how his previous relationships ended?,74,14,is good anyway ask sigoth m previou relationship end,0
,"Porn lovers, how much do you estimate you've spent on porn and/or porn related material? Ie subscriptions, porn conventions, porn-styled sex toys, etc.",151,23,porn lover much estim spent porn porn relat materi ie subscript porn convent porn style sex toy etc,0
,What can you tell a lot about a man by?,39,10,what tell lot man,0
"I know a lot of guys who don’t have the best self image, views of their looks etc.
Being a woman, it’s hard to reassure them how awesome they are, how attractive they are without them pushing it aside as me ‘just being nice’.

Any tips on things a woman could say to male friends or potential partners to help boost their self confidence?",How can you help improve a guys self confidence/self image?,59,10,how help improv guy self confid self imag,0
"Assuming there is no one with her who seems to be a significant other, and she is of age.",What factors prevent you from approaching an attractive girl/woman?,67,9,what factor prevent approach attract girl woman,0
I'm trying to find a reliable one and figured here would have some good answers!,What brand/model of beard trimmer do you guys use?,50,9,what brand model beard trimmer guy use,0
"Long story short - I (m18) went to a function last night with some friends.  I probably would’ve enjoyed myself a little more if I was a bit more social, because all I did was wallflower.

How can I get myself to be more outgoing and social?",How can I be more confident and social in big social environments?,66,12,how i confid social big social environ,0
This.,"How do you sleep in bed with someone if you toss and turn, a lot?",65,15,how sleep bed someon toss turn lot,0
,"What’s something you notice most people preach, but never practice?",67,10,what someth notic peopl preach never practic,0
What do you love about it?,What is your evening/nightly routine?,37,5,what even nightli routin,0
"Had an absolutely terrifying nightmare last night of the traditional type per-say of some twisted cross between Jumanji and Stranger Things. Normally my nightmares (albeit rare) are of things like falling back into old bad habits or disappointing my parents.

Hadn't had one this terrifying In awhile and I'm still kinda shook. Just curious what it's like for other peeps.",How often do you have nightmares?,33,6,how often nightmar,0
A lot of women want flowers or chocolate or random small gifts occasionally but how come it isn’t both ways? Sometime after a long week or a frankly stressful day I wish my partner would get me something nice. Anyone else feel the same?,Where’s my flowers?,19,3,where flower,0
,Are you an ass man or boobs guy? Why?,37,9,are ass man boob guy whi,0
,"If you were in a situation where your death would mean saving thousands of innocent lives, would you die for them? Why or why not?",130,25,if situat death would mean save thousand innoc live would die whi,0
"I have a male roommate who takes two showers a day (one in the morning, one at night). Excessive in my opinion but whatevs. The thing that weirds me out is halfway through, he'll turn the water off for a couple minutes, then start back up again. What could the reason behind that be??

I normally wouldn't care or notice but I share a wall with the bathroom so I can hear the water run very loudly.",Why turn the water off mid shower?,34,7,whi turn water mid shower,0
It's basically a referendum on eggs.,"What is the best croque - monsieur, madame or some other variant?",65,12,what best croqu monsieur madam variant,0
Edit: would actually appreciate answers more than just a couple of words haha trying to understand this and one word is hard to interpret I.e. money- lack of money? Worried about pre-nup? The other person is financially irresponsible? Cant buy a ring? What do you mean by money? Haha,"If you're currently in a relationship and very happy with your partner and your relationship, why haven't you proposed/gotten engaged yet? (Assuming you do want to get married)",176,28,if current relationship happi partner relationship propos gotten engag yet assum want get marri,0
,What would you say are the main differences between friendships with males vs with females?,91,15,what would say main differ friendship male vs femal,0
,What’s your most awkward moment being put in the friend zone?,61,11,what awkward moment put friend zone,0
"Long story short, this girl and I had agreed to try to stay friends since I knew a relationship wouldn't work in the long run. However we both still had those feelings. And after a few weeks ultimately we decided to just stop talking altogether. She didn't like me as ""just a friend"" and to try and stay friends while keeping these feelings under wraps would be torture. So we've blocked each other on everything and let it go.",How do you move on after cutting out someone you really liked?,62,12,how move cut someon realli like,0
Edit: I appreciate all the answers. I'm 26 and I just feel a certain kind of anxiety that my life has passed me by and unsure of what the future holds.,How do you cope with the realisation that you're getting older and your youth will soon be behind you? What do you wish you did more of before 30?,146,29,how cope realis get older youth soon behind what wish,0
,"Gamers, what’s the most offensive thing you’ve heard or read in game chat?",74,13,gamer offens thing heard read game chat,0
,"How much of a difference would there be in your first serious relationship, if you knew then, what you know now?",112,21,how much differ would first seriou relationship knew know,0
"Doesn't matter if it's work. Or friends. Or girls I'm dating. I always care so much about the outcome.

I want to do good at work and thrive and sometimes things are out of control and I feel bad anyways.

Friends doesn't respond or act in a very nice way to me. I feel bad even though I'm not the responsible source for their bad behavior. 

Girls I'm dating who acts badly after a few weeks or start playing games. Hurt me. Even though I know they're the crazy ones and not me. Yet I take responsibility and blame. 


And I know most of things around me are not because of me. People have their own shit that they project on to you. 

Like, I can't control peoples thoughts. Why do I get so hung up on that?    Negative emotions always stay in my body and I can't focus on anything else than the thing that messes me up.

Right now.  There's a girl I know have no interest in me. She used to have.  Now I'm just pissed of about how things could have been better if xyz happened.   I know it's ridiculous. I know I can't do anything about it.  I know for a fact I'm the better person after getting to know her more.  Yet I feel bad. Why.

Why do I keep getting stuck on things that make me feel bad when I want to move on?

I listen to positive things everyday.  I do affirmations.  And I try to always view things positively since I'm not God and doesn't control whats happening around me . (don't believe in God either but that's not important)

How can I learn to be in control of what I feel and stop being so invested in things? If I don't care I get cold and douchey. And I don't want that either 

Im a guy at 24 years old.  Have experiences in a lot of different things.  I would think I could control myself better.

Any tips guys?",How to stop being emotionally invested,38,6,how stop emot invest,0
,"Men of Reddit, what do you typically do on a day to day basis?",62,14,men reddit typic day day basi,0
"Hey,

At what age did you get your first gray hair? What was your reaction? Did you try to solve it in any way?",At what age did you get your first gray hair? What was your reaction?,69,14,at age get first gray hair what reaction,0
,"What are some ""basic bitch""-type interests for dudes ?",54,9,what basic bitch type interest dude,0
,How do you deal with a major blow to your ego?,46,11,how deal major blow ego,0
,"What makes one woman stand out to you above the rest, even though you see others who may be way more attractive every day? Are you just settling?",145,28,what make one woman stand rest even though see other may way attract everi day are settl,0
"I’m 17 at the time of writing this, it’s mid summer and I’m realizing now I don’t have anyone to lean on. I hate staying inside so I often go out and do things, but I’m always by myself.

I look around and see all these people in groups laughing talking, taking the attention off of themselves, and here I am, alone in a crowded room.",How do you form lasting friendships with people? And how do you deal with being alone?,86,16,how form last friendship peopl and deal alon,0
,What is a man?,14,4,what man,0
,What made you cry lately?,25,5,what made cri late,0
,"If you were given the offer to restart your life since childhood with all the knowledge that you currently have to change things, would you accept it? Why or why not?",166,31,if given offer restart life sinc childhood knowledg current chang thing would accept whi,0
,"What's something you only enjoy drunk or hammered, but not while you are sober?",79,14,what someth enjoy drunk hammer sober,0
When you visit strip clubs and the girls approach you to chat and ask for a dance what do you talk about? I usually ask them name age and where they are from but after that it gets a little awkward. But i see that other guys don't have that problem. What do you talk about?,How do you chat with strippers in clubs?,40,8,how chat stripper club,0
"Assuming that it's a long term thing. Here they are:

1)Physical attractiveness 
2)Brains &amp; Intellect 
3)Sense of Humor 
4)Ambitious 
5)Friendly &amp; Sociable 
6)Kind 
7)Caring, Affectionate &amp; Puts in efforts 
8)Communicates well 
9)Similar interests 
10)Good in bed","If you could only pick 5 of these qualities in your woman, what would they be?",78,16,if could pick qualiti woman would,0
I am an 18 yo and wish to learn something useful. I will be further doing engineering in cs as well. How do I start?,What's the best way to start coding from scratch?,49,9,what best way start code scratch,0
,What's your go-to artist or playlist to workout to?,51,9,what go artist playlist workout,0
,Men what would you do if your mother was disrespectful towards your wife/partner?,81,13,men would mother disrespect toward wife partner,0
"When you're seriously looking for the love of your life, how important is it to you, that she makes a decent living? If it *IS* important to you, why is it important?",First I Look at the Purse. How about you?,41,9,first i look purs how,0
,How would you get into a deep conversation with a female?,57,11,how would get deep convers femal,0
,What’s the most 2019 question you can think of,46,9,what question think,0
,How to remove beard shadow after shaving ?,42,8,how remov beard shadow shave,0
"in the mood to read about some heartbreak and fucked up shit, lay it on me!",What’s the shittiest thing someone you were interested in/dating has done to you?,81,13,what shittiest thing someon interest date done,0
,What are some compliments you would like to hear from your sigoth?,62,12,what compliment would like hear sigoth,0
"For reference I have a fairly full face of hair that I prefer to keep about 12mm long with an electric trimmer.

I trim over the hand wash basin and either lay down a hand towel which needs shaken awkwardly into the toilet bowl for flushing or (the environmentally unfriendly option) 10+ squares of toilet paper.

Stubble hair is still left after cleaning and it's a right pain to clear up, probably taking just as long as the job itself.

Advice on a more efficient method?

--Edit--

Sounds like common consensus is that I've been doing it wrong. Thanks all, will change it up!",How to trim a beard without getting stubble hair literally everywhere?,70,11,how trim beard without get stubbl hair liter everywher,0
,What's the oral etiquette,25,4,what oral etiquett,0
,What is your biggest problem right now that is completely unimportant in the grand scheme of things?,100,17,what biggest problem right complet unimport grand scheme thing,0
,How much toilet paper do you use?,33,7,how much toilet paper use,0
,Whats something you feel you’re missing in your relationship?,61,9,what someth feel miss relationship,0
"It's super dumb, I realize, but... personally, I've always feared that I have chicken legs. I joined track in high school, powerlifted in college, and am pedicabbing in my post-studies life. All catalyzed by my calves being too small.

What are all y'alls insecurities?","Fellow men, what are you insecure about?",40,7,fellow men insecur,0
"So recently i’ve been talking to two girls at the same time. 

I met one off of tinder back in like february, went on one date, fizzled off and then we started talking about a week ago. We then went on a movie date and have been texting back and forth. Nothing’s happened so far and its hard to tell if we have good chemistry because she’s sort of reserved. We both said we like each other but have yet to act on it. I’m not sure if I entirely want a serious longterm relationship with her, sort of more of a summer fling thing if we were to go out. Which I plan on talking to her on our next date if I don’t break it off just yet. 

I met the other girl at a bar about 2 weeks ago, and have been talking since then too. We have a ton in common, way more than the other girl off of tinder and get along great. Mind you we had great chemistry while at the bar dancing. But she just got out of a serious relationship and I’ve been trying to get her to go out on a date with me but she’s nervous about it. If this wasn’t an issue, I definitely would’ve already gone on a date with her but she keeps putting it off. If we were to go out, I would be more open to a long term relationship. But because it’s so up in the air, i’m not sure if I should jeopardize the other possible relationship with the other girl just to pursue bar girl. 

I feel bad/shitty talking to two girls at a time but I’m not sure since it’s still on a go with the flow basis. I’m just stumped at what to do. I could just keep going out with tinder girl, or cut it off and try to do my best with bar girl.","Talking to two girls at a time, don’t know what to do.",54,12,talk two girl time know,0
,What’s your conspiracy theory about women?,42,6,what conspiraci theori women,0
"I think I know what it means, but if I’m honest, a future with anyone sounds scary. I don’t know how people “just know” someone is “the one”. Everyone says you will just know, but how? It’s scary to think of being with one person for the rest of your life. I’m in love but I also worked hard at being independent and on my own, I want intimacy and love, but it can be overwhelming and can make me feel trapped. Do most people feel that way or am I the exception?",What does it mean to see a future with someone?,47,10,what mean see futur someon,0
,How do you guys cope up with sudden mood changes?,49,10,how guy cope sudden mood chang,0
"So my gf just got a breast reduction. I want to help her with her body image and help her to feel more comfortable with her new body, but she has some pretty bad scars atm. How do I help her feel sexy and loved in spite of her scars? I work hard to make her feel sexy already, but I feel like she could use a little extra rn, but I don't want to come off as patronizing.","Men of Reddit, how would you help your sigoth feel sexy with their new scars?",73,15,men reddit would help sigoth feel sexi new scar,0
"I'm going to try to keep this as short as I can.  TLDR at the bottom. 

My husband got out of the marines in early 2016, and shortly after enlisted in the USAF reserves. Through schooling and opportunities he has been able to be active reserves and we live on base. Throughout our relationship &amp; marriage we lost a son at birth (we knew it was coming, he didn't develop kidneys) and twins in utero at 12 weeks. We've yet to carry any children successfully and I know this bothers him. I am currently pregnant but without answers from our other losses, the pregnancy is stressful for us both, especially him. He  is my rock and has always listened when I need him to and taken care of me when I was down or sick. He to help himself threw himself into work and only broke down once in front of me. 

3 months ago we got into an accident on base and my husband got into an altercation while in uniform with the service member who hit us. It wasn't a bad accident, fender bender. His over-reaction caused him to get a Letter of Reprimand which was honestly a slap on the wrist to what he could've gotten. Due to this incident he has been labeled unsafe in the work environment and unpredictable but is still allowed to keep his job. These labels really bother him though. This is the opposite of the man I know, he is level headed and doesn't engage in arguments unless absolutely necessary, he is one of the least emotional men I know. I do know in moments of extreme anger he has gotten mildly physical with his mother before - this was after a solid week of her berating me for not doing something she hadn't told me to do. It was not his proudest moment but he put his hand over her mouth and told he to ""shut the fuck up"", promptly after he apologized and left. (We've discussed that I will leave at the first signs of physical violence towards me so my safety is a non-issue.) He has since made up with his mother and she says it was her fault, she pressed him too hard. I remain neutral to it. 

Per his LOR he is required to see a psychologist and he has been opening up to me a lot since then. He told me a few minutes ago there are times he wishes he just wouldn't wake up, he feels like a burden on everyone. I asked how long he's felt this way and he told me on and off since he left the Marines in 2016. I'm at a loss because he's always been my rock and hasn't shown signs of depression but that doesn't matter. I want to help him. 

What can I do to help him at home? I'm always a listening ear, he rarely opens up but I'd like to encourage that. Any advice helps, thank you.

TL;DR Husband is suffering from depression, how can I help and encourage him?",How do I help my husband with symptoms of depression?,53,10,how i help husband symptom depress,0
,"Men who have/had Premature ejaculation, how did you fix or deal with it?",72,13,men prematur ejacul fix deal,0
,What would you think of a heterosexual man who said he wished he could be bisexual (but couldn’t) and admires his own dick as looking “majestic”?,145,26,what would think heterosexu man said wish could bisexu admir dick look majest,0
"Just something lighthearted after a long day. Wholesome is fine but sarcastic and inappropriate is better. I've got /funny, /jokes and /animalsbeingjerks. Any other good ones that make you guys laugh? Thanks :)

Edit: Awesome suggestions everyone — thank you! I now have hours of new excuses to waste time and procrastinate 👏👏",What are some funny subs?,25,5,what funni sub,0
"I don't want to hurt anybody by releasing my emotions at the same time it is getting increasingly difficult to keep it inside.

I have tried boxing and guitar but no improvement.","How do you channeling hurt, pain and frustration in the right channel?",70,12,how channel hurt pain frustrat right channel,0
Come on guys let's drive that feels meter up.,What unexpected small but wholesome thing did you experience in your current/past relationships?,96,13,what unexpect small wholesom thing experi current past relationship,0
,What makes a strong woman in your opinion? As in how can you tell she is strong?,80,17,what make strong woman opinion as tell strong,0
,"What are the Pros & Cons of spending $9,000+ on building a gaming PC?",73,14,what pro con spend build game pc,0
"Hello Everyone. 

In my group of friends(age23-25yrs old), there's one guy who always teases me for having a small dick. I don't know how or when he saw it but he doesn't leave an opportunity to tease me whenever all of our friends meet together(once in two months). Yes, I do have a small dick but I have accepted myself for it. Why should I worry about something I can't change? But sometimes when he teases me like"" You won't be able to satisfy a women"",""Call me when you fuck your wife"", I feel bad latter on and feel a bit depressed during during sleep which leads me to masturbation. None of my other friends seem to care about it or just chuckle. What is Best reply/Best thing to do to this guy?",What is the Best Reply I could give to anyone who teases me for having a Small Dick?,84,18,what best repli i could give anyon teas small dick,0
"Depending on the severity of the staring your reaction can change, but what do you do when you happen to see another guy checking out the person you're with?",How do you deal with other guys checking out your sigoth?,53,11,how deal guy check sigoth,0
,What traits in a girl would lead you to friendzone her?,55,11,what trait girl would lead friendzon,0
