text,title,char_count,word_count,clean_titles,target
,"Bisexual guys, what's a total turn-on when from a guy, but a turn-off when from a girl? (and vice versa)",104,20,bisexu guy total turn guy turn girl vice versa,0
"I mean like people who have confessed a love, one day got the courage to ask them out, and were rejected.","Men who have asked out a longtime friend and were rejected, how did you recover?",80,15,men ask longtim friend reject recov,0
Is the thing of 'guys will just swipe right on every profile then decide later' true?,"Guys on tinder style dating apps, how picky are you when swiping right?",71,13,guy tinder style date app picki swipe right,0
Edit: so basically what I have gotten out this post is that basically all would fxck one but most wouldn’t date,How many men in their 30-50s would date a women in her early 20s? And if not why not ?,86,20,how mani men would date women earli and,0
,Single men how do you spend your weekend?,41,8,singl men spend weekend,0
,"What are some clothing/fashion related things that seem douchey, in your opinion?",81,12,what cloth fashion relat thing seem douchey opinion,0
,How did life change once you got a 6-pack? (Not beer),53,11,how life chang got pack not beer,0
What’s make your morning better?,How do you start your day? What is your morning schedule?,57,11,how start day what morn schedul,0
,"Have you ever intentionally lead someone on to stroke your ego, if so why?",74,14,have ever intent lead someon stroke ego,0
Edit: Also ass.,What's the best way to Lose belly and face fat?,47,10,what best way lose belli face fat,0
"Money, property, items and etc?","Men who don't want/have children, what are you doing with the things you leave behind once you die?",99,18,men want children thing leav behind die,0
"Not in the bridal party or anything. It’s in a week. 

I’m going by myself, none of the friends I know are able to put me up, so if I go I’ll need to rent a car/Uber, hotel, etc.",How mad would you be if an out of state buddy skipped your wedding?,67,14,how mad would state buddi skip wed,0
,"Men, what were you like as a teen?",34,8,men like teen,0
,"If this applies to you, why are emotionally unavailable? Have you ever loved someone and wanted a relationship deep down and not gone for it due to being emotionally unavailable?",178,30,if appli emot unavail have ever love someon want relationship deep gone due emot unavail,0
"We’ve all been ghosted, but I hate wondering what I’ve done to actually be ignored, sometimes I want to message them and ask them.",What are the reasons you think you’ve been ghosted?,51,9,what reason think ghost,0
,What’s something you see a lot of women do when they’re flirting that you see as awkward?,89,17,what someth see lot women flirt see awkward,0
"I’ve been chatting with a man since April on WhatsApp.  I’m having a hard time keeping him to have a conversation, and sometimes he doesn’t text back for hours.  He’s a few states away and we’re getting close to setting up a meet soon.  We have decided on driving five hours to meet each other in the middle.  I am entertaining the idea of a long distance relationship.  We met on a matrimonial app and neither of us are in a rush to get married, but we both want to get married one day.  I’m not much of a phone person and idk what we’d talk about over the phone.  To the men of reddit, how can I keep myself interesting or make him want to message back and forth more often?  May I add I’m always the one to text first.  I don’t mind that, but wanted to put this out there.  We’re planning on a phone call before we do meet each other.",How to keep a man interested in LDR,35,8,how keep man interest ldr,0
"I have massive issues with taking the initiative, and I tend to overthink everything to the point where I talk myself out of everything - socializing, looking for work, romance, etc.

It’s gotten to the point where I’m so fed up with the part of myself that’s scared of getting hurt that I’m ironically getting incredibly worried that I’m hurting myself by not doing anything...

I’m turning 19 in a month, and I’m worried as all hell about my future. I talk myself out of talking to girls, thinking no one finds me attractive in any way shape or form. I constantly shirk looking for work unless it is directly benefitting myself in the moment/some long term goal I have. It’s getting to the point where I’m not even sure if I’m just lazy.

I’ve stopped the self deprecating humor jokes and have just resorted to asking those closest to me for brutal criticism in the hopes that it will hit me like a truck and that something will eventually click to change all of it, but I haven’t gotten shit done. College is way too far out for me to be patient... I want to fix shit with myself now. No drivers license, job, etc. going on rn. There had to be something I can do to fix myself, isn’t there?",How can I fight the less productive and scared side of myself?,62,12,how i fight less product scare side,0
As the title says: what do you guys find tasty/appetizing after a session? what about drinks?,What do you guys eat/snack after sex?,37,7,what guy eat snack sex,0
,What changes/habit have you made in your life that let you live a healthier lifestyle?,86,15,what chang habit made life let live healthier lifestyl,0
"Guys in their 20s, when it comes to dating or generally interacting with women in the same age range what are your biggest frustrations &amp; why?","Men in your 20s, what are your biggest frustrations with women who are the same age as you?",91,18,men biggest frustrat women age,0
,What is required of a girl for you to take her on a date?,57,14,what requir girl take date,0
,How do you maintain your personal good hygiene ?,48,9,how maintain person good hygien,0
,"Have you ever gone out with an ex girlfriend’s best friend? If so, how did it work out?",87,18,have ever gone ex girlfriend best friend if work,0
*in your real life.,"If you found out that you were actually a supporting character, how would you go about finding out who the main character is?",125,23,if found actual support charact would go find main charact,0
I have this problem and wonder if there is anything aside from deodorant that will help. (Or a specific type of deodorant),"Men who have strong odor, how do you deal with it?",50,11,men strong odor deal,0
"Rejection is a normal part of life, I get it. But it still hurts to be rejected when I thought something could work. And these aren't complete strangers either, we start as friends. And it especially hurts when my crush either become interested in someone else after I've asked, or already had a boyfriend to begin with. 

So many of my friends have dated, have healthy relationships, and especially long lasting ones. I don't want to be jealous or envious, rather I turn my discomfort towards myself, feeling inferior and awful for not having successful qualities and life like theirs. 

So many people have given me advice like just be OK with myself, work on myself, focus on my own interests and love will come eventually. But at the same time I get advice telling me I have to change in order to be more suitable. Which is it? Do I become more genuinely myself, or become someone else to fit in? Am I supposed to be happy with myself, or happy with someone else? I'm trying to have a life philosophy to keep me functioning, but these paradoxes make me question it. 

Is something wrong with me? Am I not attractive? Am I just unlucky? I can't shake off the feeling that no matter what I do, and no matter how much I focus on genuine growth, even if I try to be the best me possible, I will still *never be enough*.",How to cope with rejections and being surrounded by couples?,60,10,how cope reject surround coupl,0
,What's the male equivalent of a girl getting flowers?,53,9,what male equival girl get flower,0
,"Men who have been in an abusive relationship, what did your sigoth do in your next relationship to help you heal or feel more comfortable?",134,25,men abus relationship sigoth next relationship help heal feel comfort,0
"Hit my ego a little bit. I went to a booty call and went soft like mid bang. Probably has something to do with my autoimmune  shit and the fact I had 6 hours sleep over 2 days.

Anyone care to share their fuck up?",What's your sexual fuck up story?,33,6,what sexual fuck stori,0
,"Men of reddit, do you think your first love story was special or not particularly? Why?",87,16,men reddit think first love stori special particularli whi,0
"Longterm relationship. Your Spouse has never orgasmed, ever, not even alone. Enjoys sex, but will never get over the top with you, or his/herself.

Would you stay by her/his side? Would the unability to please your partner make you serch elsewhere?",What would you do with a partner that physically can't orgasm?,62,11,what would partner physic orgasm,0
"My father-in-law was a real sociopath who did some absolutely horrific things that left my husband, brother-in-Law, and mother-in-Law in a pretty messed up place mentally, emotionally, financially, you name it. 

Fast forward 15 years, my husband is now a father to our son. He has a huge complex about being a “bad dad” because his dad was so terrible. He’s worried he’s tainted somehow and destined to f- it up. 

I tell him that isn’t going to happen; that he loves our son and I can see him being a great dad all the time, But he still gets in a bad headspace sometimes about it and worries he’s not doing a good enough job. 

Wondering if you have any advice on how I can support him? He is in therapy already and does have dad friends of various ages he can confide in. I’m more curious how I can help him if you have any ideas.

Thanks!",men who had shit dads - how did your sigoth help you on your fatherhood journey?,76,16,men shit dad sigoth help fatherhood journey,0
"What I'm already doing:

1. Meal prepping his meals for work. I make sure he has two different options for meals throughout his work week so he doesn't get bored. Two cups vegetables, one cup protein, one cup legumes.

2. Nights he's home (he works 7 days out of state, off 7 days and comes home for those days) I cook dinner, kind of. He has salad with no dressing and I cook fish for him. The fish varies but it's usually mahi mahi or salmon. I season it and sometimes make a small amount of glaze for the fish but mostly to make the salad less dry. 

3. I make myself available to hang out with his son while he goes to the gym. No gyms in our area allows kids under 16 so that has been an issue.

4. Just be generally encouraging. I read books and find recipes and listen to podcasts. I listen to him talk about everything and encourage everything.

5. Healthy snacks in the house when he's home. If I indulge it's during the seven days he's at work. We do have one ice cream night a month, though. Together. As a family.

He goes to the gym two to three times a day when he's home. He intermittent fasts so he only eats from 2 pm to 10 pm. He's lost about 30 pounds so far. 

He's at a point where he needs to start cutting. He wants to have more definition. I'm just looking for ways I can help him further. Any advice would be great! Thank you!

Edited because my formatting was terrible.

Another edit: he's a former pro athlete who had acl surgery and got up to 230. His knee is all healed and he just wants to get back to ""fighting"" weight. He hasn't felt good since gaining weight. I'm fine with him staying at 230, but he was miserable. So when he decided to start losing weight, I started helping wherever I could.",What else can I do to help my boyfriend lose weight/get cut?,60,12,what els i help boyfriend lose weight get cut,0
,"Great Men of Reddit, What Do You Do When Care For Your sigoth?",58,13,great men reddit what do you do when care for your sigoth,0
"Ok this may be asked a lot but I'm confused, how do you know when you're in love with somebody, when does friendship cross over into something more? And in my case nothing has happened except we talk so I'm talking about pure individual feelings.",When do you know you're in love?,32,7,when know love,0
,How often do you guys get turned on from just kissing?,54,11,how often guy get turn kiss,0
Going to my first soccer game ever next month with my boyfriend and I want to understand the game. I know nothing about soccer. I don’t want to be completely lost and sit there. I want to be knowledgeable about what is going on. Help!,How can I be a professional soccer fan?,39,8,how i profession soccer fan,0
"Every day? Mornin or evening? Work time?
Go..",What is your jerk off routine?,30,6,what jerk routin,0
"I am sort of seeing someone that I knew from back in high school. She’s now back in town and while we haven’t gone out on an official date type date, we have hung out and made out. 

My problem is despite the decade since high school it doesn’t seem like she’s changed since the ‘lol xD so random’ days of high school. So while we’ve flirted and made out I’m not entirely sure if I should pursue anything sexual if I don’t see us working long term despite her desiring something sexual between us.","Men of reddit, how many of you pursue sex with someone when you’re not sure if you want to be with them long term.",114,24,men reddit mani pursu sex someon sure want long term,0
"Today is my 22nd birthday. And I’ve had maybe 2 people besides my close family wish me happy birthday or even taken a moment to talk to me. There was no invite to go out and celebrate or anything from anyone. 

This isn’t unexpected. I feel as if I have always been the forgettable one to those around me. The friend or person someone goes to only when they need something. How do I change this? I just graduated college so it’s not like I can go out and join a club or anything. How do I go meet new people? Make better friends? Be someone people see as someone they want to be around?",How do I start fresh with new friends?,38,8,how i start fresh new friend,0
She couldn't refuse anything and she wouldn't remember afterwards.,"What would you do if you could ""have your way"" with your crush for an hour?",75,16,what would could way crush hour,0
,What are some more subtle ways that would give away to a woman you are into her?,80,17,what subtl way would give away woman,0
,How did you meet your best (male) friend?,41,8,how meet best male friend,0
,How do you avoid being anxious in the morning?,46,9,how avoid anxiou morn,0
"My wife and I are a few weeks away from the birth of our first child, a little girl; as fellow dads, what are some things I should know about raising a little girl?","Dad's of daughters, what are some things a first time dad needs to know about raising a daughter?",97,18,dad daughter thing first time dad need know rais daughter,0
,When (if ever) is it okay for you to kick/punch another dude in the balls?,74,15,when ever okay kick punch anoth dude ball,0
,What would you do if a man at a bar picked a fight with you?,60,15,what would man bar pick fight,0
,How long did it take you to fully get over your first love?,59,13,how long take fulli get first love,0
,Men of Reddit what have you done in the past when your sigoth doesn't approve of female frienships,94,18,men reddit done past sigoth approv femal frienship,0
,What's the hottest thing about your girl cumming during sex? Is it the knowledge you made it happen/how it feels when she contracts/the noises she makes/how she moves or something else?,185,31,what hottest thing girl cum sex is knowledg made happen feel contract nois make move someth els,0
"I personally named my little stud ""Chad""",What name did you give your penis?,34,7,what name give peni,0
,"Single men, what is your first reaction to receiving a cheesy just saying hi poem via text from a single female coworker?",121,22,singl men first reaction receiv cheesi say hi poem via text singl femal cowork,0
,What would be the perfect date for you?,39,8,what would perfect date,0
,What is your favorite pastimes,30,5,what favorit pastim,0
,What would the world be like if the male and females swapped anatomies?,71,13,what would world like male femal swap anatomi,0
"So I started focusing more seriously on my fitness goals earlier this year and although things have been going well (muscle and strength -wise), weight loss is always hit or miss.  So I want to be more strict with tracking my calories.

So which ones have you used?  What did you like about them?  What didn't you like?  And which one do you currently use now?",What calorie counter app would you guys recommend?,50,8,what calori counter app would guy recommend,0
,If you had to pick just one guy or bro movie what would it be? Mine is either the Town or Boondock Saints,105,23,if pick one guy bro movi would mine either town boondock saint,0
"How long have you been together?
Ideal Min and Max?","Men currently in relationships, how often would you like to have sex with your partner?",87,15,men current relationship often would like sex partner,0
,What’s something that women shouldn’t feel insecure about?,58,8,what someth women feel insecur,0
,"Like in anime, who do you live to protect and fight for in this world? Why?",75,16,like anim live protect fight world whi,0
,How and when was your first kiss experience?,44,8,how first kiss experi,0
"What would you think of a woman in her mid twenties or late, that has never dated/had relationships or had been pursued. 
Would you date her? Would you have some red flags alert on?",What would you think of a woman who has never dated/had relationships and never been pursued?,93,16,what would think woman never date relationship never pursu,0
,What was the most love you have ever received from a woman other than your mother?,82,16,what love ever receiv woman mother,0
,"Men with short-tempered, neglectful or otherwise distant fathers, how do you think it shaped your personality? Do you see any of yourself in your old man?",154,26,men short temper neglect otherwis distant father think shape person do see old man,0
Hello ask men. I’m curious to see what you are most comfortable in and what kind of an outfit do yo choose to wear most days,"Men, what does an everyday outfit look like for you?",52,10,men everyday outfit look like,0
,"What is your experience with someone being ""the one who got away""?",66,12,what experi someon one got away,0
Every guy secretly has a Disney song they really enjoy. What is yours?,In your opinion what is the best Disney song ever?,50,10,in opinion best disney song ever,0
,"Waiters, what shoes do you wear?",32,6,waiter shoe wear,0
"Just to clarify I'm not talking about being father or anything. That's a role. What makes you, you?",What is your identity and how did you discover it?,50,10,what ident discov,0
,What is a typical ‘manly’ food from your country?,49,9,what typic manli food countri,0
,"Men over 50, how much has your style changed since you were 20?",63,13,men much style chang sinc,0
"I’m introverted, prefer to sit alone with a pair of headphones and ignore people around me. I happen to be a nice guy tho so I often get attention from the ladies even tho I don’t want any relationship. Many girls seem to get upset when I don’t return the affection even those who just met me. What are some ways to sway away the ladies for now that I wanna be single, without offending them? I’m thinking of saying I have a girlfriend. Like I said, I’m introverted and shy when it comes getting to know people, I’d prefer to wallow alone.","Single man wanting to be single. Introverted, how to sway away unwanted attention?",82,13,singl man want singl introvert sway away unwant attent,0
,What is the most important thing that guys should understand about women?,73,12,what import thing guy understand women,0
,"Men who accidentally hit their ladies while sleeping, how did you stop?",71,12,men accident hit ladi sleep stop,0
Been thinking about getting one for a while but just never pulled the trigger. Was curious why you guys might've gotten yours.,"Men with tattoos, what prompted you to get one?",47,9,men tattoo prompt get one,0
"I'm not totally dreading it, but it'll definitely be weird. I'd love to hear some positive stories about people in their 30s. I've accomplished a fair few things, but not as much a I wanted, and I feel strange about it.",I'm turning 30 next week. What *positive* things can I expect?,62,11,i turn next week what posit thing i expect,0
"Hi everyone, I'm a teen and I tend to blush alot in the worst situations, you can imagine what I'm talking about. I go as red as a tomato, so it's very obvious when I am doing it, honestly it has kind of become a meme in my classes. Is there anyway to get it under control?",How to stop blushing/going red?,31,5,how stop blush go red,0
"I (23M) am in good health and average weight, I work out frequently, and yet I still snore like a train. I’ve read some stuff online and have tried to sleep more on my stomach, but I usually turn while I sleep and so that doesn’t always work. What have you done to help out for yourself?",Men who snore - what have you found that works to make your snoring quieter or stop all together?,97,19,men snore found work make snore quieter stop togeth,0
"I keep running into the issue where I find guys incredibly attractive (they are, its not just me) and try to tell them via compliments or reassurance so they’ll feel good about themselves, but usually they just brush it off and/or don’t believe me. What can I do to make it stick and help them see what I see?",How do I get guys to realize they’re attractive?,48,9,how i get guy realiz attract,0
Somewhere in your heart do you wish you could pursue her ? does how attractive she is play a factor? If she came to flirt how would you act? Would you let her physically touch you in a “friendly” way ?,How do you feel when women hit on you when you are already in a relationship?,77,16,how feel women hit alreadi relationship,0
"I was just having a conversation with a friend about this and wanted to get others' opinions. 

It seems like a substantial number of girls I've dated recently make negative generalizations about men. Pulling from the last several: (""men are responsible for global warming"", ""men are responsible for fracking and spread STDs everywhere they frack"", ""men are worse than women in leadership roles. Most leaders should be women."", ""women are better at handling stress than men"", etc.).

My general reaction to this is to take it personally (ie the girl includes me in the ""men"" she is discussing), view it as a sign that she probably has a more negative view of men across the board and take it as a deal breaker. I don't go out with these girls again.

My friend thinks my dates are implicitly saying this applies to all men except me, the girls do not think negatively about men as a group and this should not be a deal breaker. 

How do you react to girls like this?","When a date makes negative or slightly derogatory generalizations about men, how do you react?",94,15,when date make neg slightli derogatori gener men react,0
This would be like the “Donner Party”.,"One day, you end up on a stranded island that has no food with a random group of people. People start dying of starvation and other causes, would you eat the deceased to survive? Why or why not?",194,38,one day end strand island food random group peopl peopl start die starvat caus would eat deceas surviv whi,0
"Based on whatever they did to you, or how they act",How often do you encounter girls that you would describe as “creepy”?,69,12,how often encount girl would describ creepi,0
,How old were you when you learned how to make a basic roux and who taught you?,78,17,how old learn make basic roux taught,0
,How were you led on by someone?,31,7,how led someon,0
,"Men who didn’t think they could have gotten over an ex but eventually did, how did you?",87,17,men think could gotten ex eventu,0
And I call this dumb because I still kept eating it as I was getting burned. Momma didn't raise quitter regardless of whether molten chocolate was in my mouth or not.,"I practically burned the roof of my mouth off while eating a smore on the 4th, and now I can't eat solid foods for a few days while it heals. What's the dumbest thing you've done recently?",188,37,i practic burn roof mouth eat smore th i eat solid food day heal what dumbest thing done recent,0
