text,title,char_count,word_count,clean_titles,target
"
Due to [popular demand](https://www.reddit.com/r/AskWomen/comments/3oef25/meta_would_you_want_to_see_a_day_in_raskwomen/), every Monday from 12am ET and (-5 GMT) until 12am on Tuesday, submissions related to dating, relationships, or attraction will be removed.;


Examples of things we'll remove:


* What do you look for in a partner?


* What does your SO do that you love/annoy you?


* Are you attracted to [feature]? (Includes celebrities)


* Would you ever date noted guitarist Slash?


* Is [thing] a red flag/yellow flag/dealbreaker/white flag?


* What do you think about men who eat muffins alone in coffee shops?  How about the sexiest way for them to remove a jacket, or zip up hoodie?


If you have any questions about these supplemental rules, please [message the moderators](https://www.reddit.com/message/compose/?to=/r/AskWomen&amp;subject=Questions+about+mate+free+monday) and we will be happy to discuss it with you.


~The AskWomen Mod Team","The supplemental rules for ""Mate-Free Monday"" are now in effect.",64,10,the supplement rule mate free monday effect,1
,"What is something your mother taught you (tip, life hack, etc) that you will most likely pass along to your daughter?",117,21,what someth mother taught tip life hack etc like pass along daughter,1
"I recently read a comment on an article about setting yourself up for a successful interview from a woman who identified herself as a hiring manager. She expressed that something rather insignificant that she pays attention to during the interview is a **female** candidate's fingernails.

Not just if she fidgets or picks at the polish, but the shape and the color and how well kept her nails are. She however did not answer when another commentor asked her if it influenced her hiring decisions or if she gave the same level of scrutiny to men.

It got me thinking about how much I pay attention to my own fingernails. I am aware that my fingernails are in general an outward sign of how anxious I am. They are always clean, but I sometimes bite them or pick at them when I am feeling on edge. Now I am wondering how judged other people feel about their nails in professional and casual settings.

Do you have expectations or opions about ""professional looking"" fingernails?

Edit: typos.",How conscious are you about how well groomed your/other people's fingernails appear? Do you make judgements about others based on their nail maintenance choices?,161,24,how consciou well groom peopl fingernail appear do make judgement other base nail mainten choic,1
,Ladies who love to be alone: how did you get used to living with your sigoth?,73,16,ladi love alon get use live sigoth,1
"It feels like with the emergence of technology I've noticed that it seems like all style era's are coexisting. In your opinion, what style is most prevalent in the 2010's?

&amp;#x200B;

What will we be wearing in our 2010's throwback parties in 2050?",What will the 2010s be remembered for style wise?,49,9,what rememb style wise,1
Edit: Thanks for all these great recommendations!,What’s your favorite documentary? Why?,38,5,what favorit documentari whi,1
,"Where do you live, how much do you pay in rent, and how many bedrooms and bathrooms are in your space?",102,21,where live much pay rent mani bedroom bathroom space,1
,"Women who have decided to end long term friendships, why did you do so and how did you cope with losing a friend?",113,23,women decid end long term friendship cope lose friend,1
,What was your first thought when you got your first period?,59,11,what first thought got first period,1
,What's the most interesting non-fiction book you've read so far this year?,74,12,what interest non fiction book read far year,1
,How long do you give yourself to determine if you’re happy with your new job?,77,15,how long give determin happi new job,1
,"Those of you who have, why did you choose to give your baby for adoption & are you still content with that choice today?",124,24,those choos give babi adopt still content choic today,1
,What would you like to tell your parents someday?,49,9,what would like tell parent someday,1
Are there any tools you use? Something you think is important to bring? Any kind of tips and tricks you have I'd love to hear!,What are your top tips for packing for a trip?,46,10,what top tip pack trip,1
,"Those who’ve undergone electro convulsive therapy (ECT), what was our experience? Would you make the same choice to do the procedure looking back now?",150,24,those undergon electro convuls therapi ect experi would make choic procedur look back,1
,What's something that really shocked you as a kid?,50,9,what someth realli shock kid,1
,What do you do to make yourself feel safe while out jogging/running alone?,74,13,what make feel safe jog run alon,1
,What are some tips for recovering from social burnout?,54,9,what tip recov social burnout,1
,What scientific discoveries do you find the most interesting?,61,9,what scientif discoveri find interest,1
,How did you deal with a loved one developing an eating disorder?,64,12,how deal love one develop eat disord,1
"Note - There are some people saying ""why don't you ask men this? why ask women?""......I've already posted this on AskMen a while ago, so I just thought I'd like to see a female perspective.","Why do women so commonly acknowledge that other women are hot/beautiful, but men don't acknowledge other men?",109,17,whi women commonli acknowledg women hot beauti men acknowledg men,1
,What was the best movie you watched as a kid?,45,10,what best movi watch kid,1
And why?,Who’s your favorite character in the Harry Potter series?,57,9,who favorit charact harri potter seri,1
,"Ladies who were diagnosed with Asperger's, how did you get diagnosed? What resources did you use to research it?",112,19,ladi diagnos asperg get diagnos what resourc use research,1
,How was your medical (non surgical) abortion? What awareness would you spread about it?,87,14,how medic non surgic abort what awar would spread,1
,What is your weird quirk?,25,5,what weird quirk,1
,"A question for gamers, what is the strangest/creepiest message you have got on Xbox/PlayStation/pc ?",100,15,a question gamer strangest creepiest messag got xbox playstat pc,1
,"What do you consider to be the keys to good, effective communication?",69,12,what consid key good effect commun,1
,What types of donuts do you like?,33,7,what type donut like,1
,"Period-having people, have you ever used period underwear (like Thinx or ModiBodi) and what has your experience been like?",122,19,period peopl ever use period underwear like thinx modibodi experi like,1
,"What decision did you consider to be a major mistake at the time, but later turned out to be a positive?",104,21,what decis consid major mistak time later turn posit,1
,What book/show/movie where you really excited about but ended up disappointed after actually reading/watching it?,113,15,what book show movi realli excit end disappoint actual read watch,1
,What is one thing you can do to improve your life?,50,11,what one thing improv life,1
,How does your life today differ from the one you dreamed of as a kid/teenager?,78,15,how life today differ one dream kid teenag,1
,"Has anyone here decided to have kids while struggling financially, and if so why?",81,14,ha anyon decid kid struggl financi,1
,How much do you have in retirement savings/savings in general? (Stolen from r/AskMen),85,13,how much retir save save gener stolen r askmen,1
looking for recommendations as i haven’t read for fun in years. open to try any genre!,what is your favorite book?,27,5,favorit book,1
,"Women who have relatives the same age (siblings, cousins) where one of you became successful and the other one unsuccessful, what happened?",139,22,women rel age sibl cousin one becam success one unsuccess happen,1
,How did you find your inner happiness?,38,7,how find inner happi,1
"Check to check? Deep in debt? Financially independent? 

How much time do you spend worrying about it? How much does it restrict you from?

Also how old are you and, more importantly, how much of this did you get from your parents (or whoever raised you), either in terms of literal monetary or asset inheritance or gifts, or the patterns or priorities you picked up?",What's your relationship with your finances?,44,6,what relationship financ,1
,What is your opinion on the trailer for the live action remake of Mulan?,72,14,what opinion trailer live action remak mulan,1
,How was your eyebrow transition throughout life and how old were you when you first started plucking them?,106,18,how eyebrow transit throughout life old first start pluck,1
"What is your hair type? Color? Where on your head did you first notice your grays? Do you know if you had a parent that went gray early or late and did you follow the same trend? 

Particularly curious to hear from the other natural blondes.","Ladies, at what age did you first start to gray?",48,10,ladi age first start gray,1
What symptoms or concerns led your doctor to test for it or to suspect it ? Or what made you decide to bring it up with your doctor in the first place ?,Question for those of you with endometriosis. How did you find out find out that you had it ?,93,19,question endometriosi how find find,1
Including your family size would be helpful as well.,"On average how much do you spend on groceries and alcohol to drink at home every month? And how much do you spend on restaurants, bars, takeout/delivery?",153,27,on averag much spend groceri alcohol drink home everi month and much spend restaur bar takeout deliveri,1
,What do your legs look like if you don’t shave?,47,10,what leg look like shave,1
,Do you believe that not being a vegan/vegetarian is not ethical? Why or Why not?,80,15,do believ vegan vegetarian ethic whi whi,1
,What inventions or discoveries do you wish you would have liked to have been around to witness?,95,17,what invent discoveri wish would like around wit,1
,What has made you question your beliefs recently?,49,8,what made question belief recent,1
,What’s your drink?,18,3,what drink,1
,What's something that a lot of other people want that you aren't interested in/couldn't care less about?,104,17,what someth lot peopl want interest care less,1
,"Women who have or are planning on having daughters, how would you approach the topic of sex? Would you help them get birth control, and if so, what age is too young?",165,32,women plan daughter would approach topic sex would help get birth control age young,1
,What weird food craving did you have while pregnant? And what kind of food couldn't you stand anymore?,102,18,what weird food crave pregnant and kind food stand anymor,1
,What toxic behavior do you sometimes catch yourself exhibiting?,63,9,what toxic behavior sometim catch exhibit,1
,How do you feel about the USA Women’s FIFA team just winning the World Cup right now?,85,17,how feel usa women fifa team win world cup right,1
,Women who had a huge glow-up: In what way is your life different now?,69,14,women huge glow in way life differ,1
,What is the most absurd monthly expense you have but cannot opt out of? How much does it cost you?,98,20,what absurd monthli expens cannot opt how much cost,1
,"How often do you and your sigoth fight? If you used to fight a lot, how did you stop?",81,19,how often sigoth fight if use fight lot stop,1
,What simple health tips do you recommend people to start doing?,63,11,what simpl health tip recommend peopl start,1
,"Women who were very scared or extremely anxious about pregnancy and/or birth, how did it all go, and how is motherhood going?",125,22,women scare extrem anxiou pregnanc birth go motherhood go,1
,"If you had to describe yourself in five words, what would they be?",66,13,if describ five word would,1
"I am wondering whether it could be a viable option. While it may be quite expensive, I would like to prepare for the worst case scenario. Hence, I want to know, women of Reddit, have you thought about freezing your eggs? What will be the turning point that you will decide you'd really do it?",What are your thoughts about freezing your eggs?,48,8,what thought freez egg,1
I was talking to one of my girlfriends and she told me she knew her current husband had class when he invited her to beautiful restaurants and knew his wine. What are things that make you think that someone has class?,What are things that make you think that someone has class?,59,11,what thing make think someon class,1
,What’s the worst pet name a sigoth has given you?,60,11,what worst pet name sigoth given,1
,What’s a good antiperspirant for women who sweat from their armpits excessively?,80,12,what good antiperspir women sweat armpit excess,1
"I'm curious to know what kind of habits or schedules you guys follow, anything that you think shapes who you currently are.",How does your current lifestyle look like?,42,7,how current lifestyl look like,1
,What makes you like someone on dating apps?,43,8,what make like someon date app,1
,"Ladies, what do you do when you’re feeling fugly? (Frumpy+Ugly)",63,10,ladi feel fugli frumpi ugli,1
,What's the biggest fight you've ever had with your sigoth?,54,10,what biggest fight ever sigoth,1
,What do you do on the anniversary date of one of your parent’s death?,69,14,what anniversari date one parent death,1
,"for the women that weren’t successful with online dating, how did it feel to give up the apps for good?",103,20,women success onlin date feel give app good,1
,Singles how do you spend your weekend?,38,7,singl spend weekend,1
,"Following on from the “Why don’t you get a man to do that” thread, what was your worst experience of being told “You’re a woman so you should do that”?",151,30,follow whi get man thread worst experi told you woman,1
,"What do you do when you feel stuck in life? (ie in jobs, lack of friendships, depression, etc.)",95,18,what feel stuck life ie job lack friendship depress etc,1
"If you had the chance to have been born in a different country, with the same family and circumstances, the only difference being the country and obviously the culture, would you take it? If so, where, and why?","If you had the chance to have been born in a different country, would you take it?",82,17,if chanc born differ countri would take,1
,What traits or attributes do you look for in male best friend?,62,12,what trait attribut look male best friend,1
"Specifically, lasting friendships with other women that you met after undergrad.","Women who've made new friendships in adulthood, where and how did you do it?",76,14,women made new friendship adulthood,1
"A good friend of mine (who I really liked) just asked me out, and I’m looking for similar stories :)",How did your friendship turn romantic?,38,6,how friendship turn romant,1
,"Women who's sigoth travels a lot (30-50% of the time) for work - how has that affected you, your marriage and your family?",118,23,women sigoth travel lot time work affect marriag famili,1
,Women with apparent dark/thick bum hair - Have you ever had a partner comment on it? How do you cope?,101,20,women appar dark thick bum hair have ever partner comment how cope,1
"How would you feel if you caught your partner going through your phone?

Would it mark the end of your relationship?

Would you be able to forgive and work through it?

Or do you have any sort of ""open phone policy"" to prevent snooping?","Women of reddit, what is your take on ""snooping""?",49,9,women reddit take snoop,1
,How do you feel about the Mexico football team winning the Gold Cup against the U.S.A?,86,16,how feel mexico footbal team win gold cup u s a,1
,At what age do you feel like you came into your own?,52,12,at age feel like came,1
,What's a good game or fun activity for couples?,47,9,what good game fun activ coupl,1
,"Single women of Reddit, how do you deal with constant rationalizations, judgements, questions and assumptions about your singledom?",131,18,singl women reddit deal constant ration judgement question assumpt singledom,1
,Who is the most iconically beautiful woman from your country?,61,10,who icon beauti woman countri,1
,"Ladies with successful Instagram blogs, how do you find maintaining it, do you ever regret having one and does it impact your self esteem?",138,24,ladi success instagram blog find maintain ever regret one impact self esteem,1
,How did someone gave you hope when you were so down and negative?,65,13,how someon gave hope neg,1
How long do your conversarions go (average and max)? How do you keep them going? What do you talk about? Is the personality of the conversation-partner a factor? What topics do you enjoy?,What do you connect with people over?,37,7,what connect peopl,1
,"Ladies of Reddit who balance it all, how do you do it?",54,12,ladi reddit balanc,1
I refer to men who are actually learning (or attempting to) learn the material in class and not men who are there just to see women.,"Ladies, how do you feel about men in yoga/dance classes?",56,10,ladi feel men yoga danc class,1
Why? When do you think it ends in a wider sense?,"How old were you when you felt like you started to lose your ""youth""?",69,14,how old felt like start lose youth,1
,Whatever is your sexual orientation.. or experiences .. how do you feel or what do you think about strap-on dildos?,115,20,whatev sexual orient experi feel think strap dildo,1
"e.g. in social gatherings, workplaces where people are having a conversation/activity, and there's only one man or one woman in the group","In social situations, what differences have you noticed in how men treat the only woman in the group, and how women treat the only man in the group?",148,28,in social situat differ notic men treat woman group women treat man group,1
"Hi,

What do you think of intellectuals? Everyone is intellectual in a sense, but I mean those who have it as a full-time job, writers, non-fiction authors, engaged academics, journalists, political analysts. Assuming other human qualities are met, does being an intellectual of this sort add something special to the person as a partner in your view? Or is it just like any other job?

Looking forward to reading your views. Thanks!",What do you think about intellectual people?,44,7,what think intellectu peopl,1
,"Ladies, what is your worst ""Why don't you get a man to do that for you?"" story?",79,17,ladi worst whi get man stori,1
,What are your thoughts on the U.S. becoming more conservative?,62,10,what thought u s becom conserv,1
Asking because I was told it was common courtesy/sense to return or give compliments even when it’s not genuine,What compliment do you give others but don't really mean it?,60,11,what compliment give other realli mean,1
"When you go out for drinks is it any different than if you were to go to an interview, or a date, or see family etc? Just curious because I never notice, but putting on makeup seems like a pretty versatile fashion aspect.","Do women change the way they do their makeup depending on the situation? If so, how is it different?",100,19,do women chang way makeup depend situat if differ,1
,What slang for women or their bodies do you like or not like?,61,13,what slang women bodi like like,1
,What is your proudest achievement in life?,42,7,what proudest achiev life,1
,How do you like your eggs?,26,6,how like egg,1
Especially if you've lost friends along the way,"Ladies who have been defamed by their former partners, how did you overcome it?",79,14,ladi defam former partner overcom,1
,What do you about people who say that men have higher sex drives than women?,76,15,what peopl say men higher sex drive women,1
,"Women who have never been single, or have been for a short amount of time from one relationship to another, how did you do that?",128,25,women never singl short amount time one relationship anoth,1
"I’m curious what your opinions are on this. I’m also not sure if there is some unofficial ‘etiquette rule’ regarding when you switch from
addressing someone as ‘young lady’ to ‘ma’am.’","At what age is it no longer appropriate to address someone as ‘miss’ or ‘young lady’? (As opposed to ‘ma’am’, which is the older equivalent)",140,25,at age longer appropri address someon miss young ladi as oppos older equival,1
,How often were your pregnancy tests accurate?,45,7,how often pregnanc test accur,1
,"Do you feel obligated to have children? If you do, why?",55,11,do feel oblig children if,1
,"When the newspapers are full of stories about awful men, how do you remind yourself that most men are good?",107,20,when newspap full stori aw men remind men good,1
,"At girls sleepovers, do you really have pillowfights and talk about your crushes or is that just a myth? And if so, what do you really do?",138,27,at girl sleepov realli pillowfight talk crush myth and realli,1
,How do you develop curiosity when you're not a curious person?,62,11,how develop curios curiou person,1
And what makes you believe it's truly over?,What was the longest it took you to get over someone?,53,11,what longest took get someon,1
,"When was a time you said something, only to realize a moment later that it was a pretty ignorant thing to say?",110,22,when time said someth realiz moment later pretti ignor thing say,1
,How do you know when you’re ready for a relationship again?,59,11,how know readi relationship,1
,"If you had to design a sexualised male character, what would he look like?",74,14,if design sexualis male charact would look like,1
"it went out-of-stock within like a day, she was selling them 30 bucks a pop.",How do you feel about that 19-year-old Instagram ‘gamer girl’ who is selling her bath water and the men who buy it?,115,22,how feel year old instagram gamer girl sell bath water men buy,1
,How do you react to being broken up with?,41,9,how react broken,1
Like your mother’s side or your father’s side?,What side of your parents’ families are you more comfortable with?,66,11,what side parent famili comfort,1
"How long have you been together?
Ideal Min and Max?","Women currently in relationships, how often would you like to have sex with your partner?",89,15,women current relationship often would like sex partner,1
,"Has someone superior to you developing an interest in you ever stood in the way of your work? If yes, how did you deal with it?",127,26,ha someon superior develop interest ever stood way work if ye deal,1
,Have you ever tried/considered Online Dating? How was it?,57,9,have ever tri consid onlin date how,1
,Have you ever dealt with a coworker who was a pathological or compulsive liar? How did it effect you work environment and did you do anything about it?,151,28,have ever dealt cowork patholog compuls liar how effect work environ anyth,1
,What are some tips you've been given how to live a good life as a woman?,72,16,what tip given live good life woman,1
Do you continue to feel angry even after the issues have been hashed out?  Or after you've received a genuine apology?  How do you handle that?,How long does it take you to stop feeling angry after an argument?,66,13,how long take stop feel angri argument,1
,When did you know that you were settling?,41,8,when know settl,1
,What are your thoughts on wearing short shorts together with knee socks?,72,12,what thought wear short short togeth knee sock,1
,"What is the most annoying/uncomfortable piece of clothing for you, and what is your most comfortable?",101,16,what annoy uncomfort piec cloth comfort,1
,What do you think of Stranger Things: Season 3?,47,9,what think stranger thing season,1
"Edit: that's suppose to be unexpected

Saw this post in ask Reddit and a lot of the answers were dudes. I'm curious to see how different the answers are from the women.",What was an expected turn on for you?,37,8,what expect turn,1
,What would you do if you fell for your BFF ?,44,11,what would fell bff,1
,"Lesbian couples who have children, how did you decide who's carrying the baby?",78,13,lesbian coupl children decid carri babi,1
" Excluding the ""usuals"" - exes, religion, politics...",What do you consider to be the worst type of conversation when on a date ?,74,16,what consid worst type convers date,1
,Would you ever consider making amends or reconcile with a close friend who betrayed you or you had a bad falling out with?,122,23,would ever consid make amend reconcil close friend betray bad fall,1
"I love Mel C's voice and personality, and I'm currently rocking out to Spice Up Your Life",Who is your favourite spice girl and what is your favourite song of theirs?,75,14,who favourit spice girl favourit song,1
,"Mothers, how has having children change your relationship with your sigoth?",71,11,mother children chang relationship sigoth,1
,Who were your biggest idols in high school?,43,8,who biggest idol high school,1
,Disregarding work or other formal occasions. What is the deciding factor in you choosing to wear a dress or a skirt on a particular day?,136,25,disregard work formal occas what decid factor choos wear dress skirt particular day,1
,What was the moment where a good relationship started going bad?,64,11,what moment good relationship start go bad,1
,What’s your most embarrasing memory?,36,5,what embarras memori,1
"Not directed only at women who are attracted to men, of course; the men referenced wouldn;t necessarily know your sexual preferences, nor are they necessarily relevant to this phenomenon.","Do you notice men/boys unconsciously competing for your attention when you're the only woman/girl in the group? If so, how does it make you feel?",145,25,do notic men boy unconsci compet attent woman girl group if make feel,1
,"Married women, how did you develop a relationship with your in-laws? how do you maintain it?",92,16,marri women develop relationship law maintain,1
