text,title,char_count,word_count,clean_titles,target
"Have you ever felt contained/held down or anything like that by a significant other or the relationship in general?  What was happening that was making you feel that way?

Did you say something to your partner (like have a sit down talk or maybe hint at it or imply it in a way) to try to work on it?  How did you resolve that issue?  Or did it cause you to break up?",Have you ever felt contained?,29,5,have ever felt contain,1
,What is a joke/catchphrase your friend/sigoth employs a lot that you find annoying?,79,13,what joke catchphras friend sigoth employ lot find annoy,1
,What was your first screen/username?,36,5,what first screen usernam,1
,why do so many women wear tight pants?,38,8,mani women wear tight pant,1
"Hi, I’m going to Canada in a month alone and I’m excited but also nervous! Any tips would be appreciated!",What are your tips for safe solo travel?,40,8,what tip safe solo travel,1
,Condoms are super important. What are your thoughts on female condoms?,70,11,condom super import what thought femal condom,1
"And if you feel like sharing, was there a specific tour you got the shirt from? How was it?",What band/concert tees do you have in your closet?,50,9,what band concert tee closet,1
,What product have you bought recently that you fell in love with?,65,12,what product bought recent fell love,1
,Have anyone lost a friend (or lost contact) because you moved to a different country and they are totally off the grid? If so how have you tried to get them back?,162,32,have anyon lost friend lost contact move differ countri total grid if tri get back,1
,What's your views on wearing jewellery that represents your sigoth?,63,10,what view wear jewelleri repres sigoth,1
,"Women with physically disabled family, how does having them in your life changed you? What are some misconceptions you see in current culture about them or you as their family?",176,30,women physic disabl famili life chang what misconcept see current cultur famili,1
,Whats the secret to painting your nails without nail polish getting on your finger?,83,14,what secret paint nail without nail polish get finger,1
Could really use some positivity in my life right now.,"Those of you who thought you'd never find love but actually did, what are your stories?",87,16,those thought never find love actual stori,1
,What's the coolest Zodiac sign?,31,5,what coolest zodiac sign,1
,How does your mind work?,24,5,how mind work,1
,"What’s a view or mentality that society has, that is actually harmful to both men and women?",92,17,what view mental societi actual harm men women,1
,What gives you anxiety?,23,4,what give anxieti,1
,"In Romantic Relationships, What Do You Consider As Being ""Too Attached"" One's Partner?",86,13,in romant relationship what do you consid as be too attach one partner,1
,"What is good, inexpensive, face scrub/acne fighter brand?",57,8,what good inexpens face scrub acn fighter brand,1
,What are some of your favorite horror movies?,45,8,what favorit horror movi,1
"
Because this question comes up so frequently, and podcasts are always changing, late every month, this post will serve as a clearing house for any pod you're listening to, want to promote, or are interested in learning more about.

Thank you!

~The AskWomen Mod Team",Whats your favorite podcast/what podcasts are you listening to?,63,9,what favorit podcast podcast listen,1
,What do you do to get yourself out there to meet more people? Both for finding friends or sigoth?,93,19,what get meet peopl both find friend sigoth,1
I need a pick-me-up!,"Fellow ladies, could you please remind why it is so great to be single, while everyone around me seems to be finding the One more often?",136,26,fellow ladi could pleas remind great singl everyon around seem find one often,1
,"Women of Reddit, what is your favorite kind of fruit and why? Do you eat them plain or as part of a dish?",105,23,women reddit favorit kind fruit do eat plain part dish,1
"I have always been in awe of those people who are a bit understated, and yet, so effortlessly timeless and elegant. They give off such a calming, warm and inviting energy that I have always wanted to give off too. I would be so appreciative if anyone has tips, albums, examples, etc of how they embody/live this kind of style in any/all aspects of their life.",Women who are elegant and timeless while still being understated...how do you do it?,84,14,women eleg timeless still underst,1
,What’s something you like seeing when you go to a restaurant?,61,11,what someth like see go restaur,1
,For how many of you was childbirth your most painful experience?,64,11,for mani childbirth pain experi,1
,If you see another woman with visible pubic hair (bikini line) in a bathing suit how would you feel?,100,19,if see anoth woman visibl pubic hair bikini line bath suit would feel,1
,In light of new Abortion Restrictions would you consider getting sterilized? Why or Why not?,92,15,in light new abort restrict would consid get steril whi whi,1
,What was a turning point in your life?,38,8,what turn point life,1
I could really use a pick-me-up. Has anyone been unhappy with where they were going in life and ended up carving a new path?,Any uplifting midlife crisis stories out there?,47,7,ani uplift midlif crisi stori,1
,What are you favourite teen movies?,35,6,what favourit teen movi,1
Let it all out guys,Did you get mad at someone today ? For what reason? And did you or did you not feel bad about it after confrontation ?,118,25,did get mad someon today for reason and feel bad confront,1
,Have you ever had a S/O who was too close to their family? What were the signs?,79,17,have ever s o close famili what sign,1
,Have you ever gone out with someone thinking it was platonic/casual only to realize that they thought it was a date? What ended up happening?,141,25,have ever gone someon think platon casual realiz thought date what end happen,1
,"What's the best response to ""why are you so dressed up for?"" And similar comments.",82,15,what best respons dress and similar comment,1
,What’s the stupidest way you tried to impress someone but ended up failing horribly?,84,14,what stupidest way tri impress someon end fail horribl,1
,How do you get through the post-honeymoon phase slump?,54,9,how get post honeymoon phase slump,1
,What were your thoughts on Avengers Endgame?,44,7,what thought aveng endgam,1
,How do you not let a bad dating/relationship experience traumatize you?,71,11,how let bad date relationship experi traumat,1
,What is the strangest thing that has happened to you in public ?,64,13,what strangest thing happen public,1
,What's a beauty or skin care product under $40.00 USD that you would highly recommend?,86,15,what beauti skin care product usd would highli recommend,1
"And what's stopping you from getting it, besides money?",What do you really really want right now?,41,8,what realli realli want right,1
"To those who apply, did you speak? What did you say?",What did you say at your mothers funeral?,41,8,what say mother funer,1
,Life hacks to make camping more comfy if you’re somewhat high maintenance?,74,12,life hack make camp comfi somewhat high mainten,1
,"Women of reddit who choose to be single, how do you keep the ever so persistent ""nice guys(or girls)"" away?",107,20,women reddit choos singl keep ever persist nice guy girl away,1
,"What task seems impossible, but as soon as another person does it, it's easy as cake?",85,16,what task seem imposs soon anoth person easi cake,1
,What’s your go to way to relax?,31,7,what go way relax,1
,"Women who were the stepped on friend of the group, how are you now?",67,14,women step friend group,1
"Like at what point in the courting process is it socially acceptable?

EDIT: Thanks for the replies. Very interesting. Got the complete opposite response from men lol",When is it okay for someone to tell you they want to sleep with you?,68,15,when okay someon tell want sleep,1
,"Women in formerly long distance relationships, what habits did you keep after closing the distance?",99,15,women formerli long distanc relationship habit keep close distanc,1
,"Have you ever been arrested, why?",33,6,have ever arrest,1
,What is the weirdest thing your sigoth has done in their sleep?,59,12,what weirdest thing sigoth done sleep,1
,Who is someone you found it hard to get over/stop thinking about despite only dating them briefly? What was it about them?,122,22,who someon found hard get stop think despit date briefli what,1
,"Night Shift Workers, How Do You Meet People Outside of Work?",60,11,night shift worker how do you meet peopl outsid work,1
,What extra steps do you take to make sure you never miss a pill?,64,14,what extra step take make sure never miss pill,1
,What tips do you have to keep your nails healthy when you get them done at a salon?,83,18,what tip keep nail healthi get done salon,1
"I’m curious how other women schedule there non daily beauty routines (self done or as a service): pluck/wax/shave, mani, pedi, haircut, color, massage, facial, etc. 

Also, do you schedule it out to ensure it’s done?",What is your non daily beauty routine?,38,7,what non daili beauti routin,1
,"When you say ""your type"" how much of that is personality and how much of that is physical? How does this play into getting to know someone?",139,27,when say type much person much physic how play get know someon,1
,"What’s something your mom tried to teach you and you didn’t listen, only to find out later in life that she was right?",118,23,what someth mom tri teach listen find later life right,1
"Considering doing it but I don’t think I know enough -perspective or science- about it to make an decision. Inform me, please.",What is your opinion on egg donation?,37,7,what opinion egg donat,1
,"What, in your opinion, separates the men from the boys?",55,10,what opinion separ men boy,1
,What kind of foreplay do you enjoy besides kissing and oral?,60,11,what kind foreplay enjoy besid kiss oral,1
Thanks in advance!,"Those who did/have eyelash extensions, what are some things that I should know before doing them?",97,16,those eyelash extens thing i know,1
,What does it feel or look like when your drink/drug has been tampered with/spiked?,82,14,what feel look like drink drug tamper spike,1
,"Women with emotionally draining jobs, how do you recuperate after a hard shift/couple of shifts?",96,15,women emot drain job recuper hard shift coupl shift,1
,What's your secret fear you only think about once upon a time?,62,12,what secret fear think upon time,1
I think every lady has a few tricks that makes them feel less bloated or lose a few pounds. What works for you?,Ladies: what works for you to lose a few extra pounds quickly?,62,12,ladi work lose extra pound quickli,1
"For example, I can be a bit pushy/clingy when I really like someone.","What were your ""bad"" dating behaviors and how did you get over/fix them?",72,13,what bad date behavior get fix,1
Why do you wear them?,"Women of reddit, what shoes do you wear in summer?",50,10,women reddit shoe wear summer,1
,"If you wanted to get someone to watch your favorite television series but could only show them one episode, which episode would most likely pique their interest?",161,27,if want get someon watch favorit televis seri could show one episod episod would like piqu interest,1
And why?,"If you could name a newborn boy and girl anything, what would you name each of them?",84,17,if could name newborn boy girl anyth would name,1
,Who is the ugliest celebrity you are willing to have a one night stand with?,76,15,who ugliest celebr will one night stand,1
,"Women who have terminated pregnancy, what made you decide against adoption? No judgement here. I am just genuinely interested in hearing your opinions.",151,23,women termin pregnanc made decid adopt no judgement i genuin interest hear opinion,1
,How do you avoid letting a difference in libido between you and your sigoth affect your confidence?,95,17,how avoid let differ libido sigoth affect confid,1
"Outside of formal dances or exclusive invitation only events, there doesn't seem to be a real place to where evening gown without looking out of place. But, there has got to be *somewhere* you can go, right?",Where reasonable place can you where an evening gown?,53,9,where reason place even gown,1
,Have you experienced a situation when you felt insanely uncomfortable but couldn't tell it to anyone? What happened next and how did that end?,142,24,have experienc situat felt insan uncomfort tell anyon what happen next end,1
I have that one hair on the side of my chin. I never know when it's coming back. I cant be alone,At what age did you find your randomly placed thicc (black) hair on your face?,78,15,at age find randomli place thicc black hair face,1
,How old are you and how many health (mental/physical) ailments are you suffering from?,86,14,how old mani health mental physic ailment suffer,1
,What did you have in 1999 that you no longer have in 2019?,58,13,what longer,1
,How do you feel when someone likes your instagram post from a long time ago?,76,15,how feel someon like instagram post long time ago,1
,"What’s something you love about your sigoth, and also hate them for?",64,12,what someth love sigoth also hate,1
,What do you think of men who can cook proper dishes?,52,11,what think men cook proper dish,1
,What’s a red flag that made you leave your partner in a heart beat?,67,14,what red flag made leav partner heart beat,1
From all this glittery makeup. Do you think it gets stuck in our insides like it does everywhere else? What color glitter do you hope is inside of you?,How much glitter do you think is in our bodies?,47,10,how much glitter think bodi,1
,What’s the most embarrassing thing that happened to you when you were in school?,80,14,what embarrass thing happen school,1
,What's the most useless online quiz you have ever taken?,56,10,what useless onlin quiz ever taken,1
"I have a couple ideas, but I don't wear fake nails, so what do I know.",What's the most uncomfortable/difficult thing to do with fake nails?,68,10,what uncomfort difficult thing fake nail,1
Does it bother you that police officers in a western country would force women to reveal more skin?,What's your opinion on the burkini ban in France?,49,9,what opinion burkini ban franc,1
,What are some tips you use to stop listening/watching things that amplify your sadness when having a bad day?,109,19,what tip use stop listen watch thing amplifi sad bad day,1
,What's the worst ending of a friendship you have experienced?,61,10,what worst end friendship experienc,1
,"Ladies, what’re some things y’all do to keep the spark alive in long distance relationships? And what does your partner do for you?",131,23,ladi thing keep spark aliv long distanc relationship and partner,1
,You have a love/like interest and you're coming over to their place for the first time. What are the things (or one thing) you'd like to see in their place that would make a strong impression on you?,199,38,you love like interest come place first time what thing one thing like see place would make strong impress,1
Title.,How many cats do you have and what are their names?,51,11,how mani cat name,1
,What's a sad song that's not well known that you like?,54,11,what sad song well known like,1
And why?,What is your favorite fast food restaurant to eat at?,53,10,what favorit fast food restaur eat,1
"Why do women put up with with having to reach behind themselves to fasten or unfasten a bra?  It seems like front-clasping bras would sell like hotcakes, being easier to use and not being as visible as the traditional back rear-clasping doohickey.  I must be missing something, not having to deal with one very often.  I just don't understand why rear-closure bras are the norm when they seem so difficult to reach all the way around to get to.","Man here, why aren't all bras front clasping?",45,8,man bra front clasp,1
,What is a “must have” in your wedding?,38,8,what must wed,1
,"If an ex you kept in touch with start sexting you, is that creepy ? If so, why ?",80,19,if ex kept touch start sext creepi if,1
,"Ladies, what book changed your life ?",37,7,ladi book chang life,1
,What sentence makes you happy?,30,5,what sentenc make happi,1
"Pull out perfume, pepper spray, a club, karate kick etc.?","What is your ""get rid of Johnny Bravo move""?",44,9,what get rid johnni bravo move,1
I saw this on /r/askgaybros (guy was talking about how he wish he had the experiences of a straight girl) and was wondering what you think of it,What do you think of gay men who say they’re “jealous of straight girls and the easy male attention they get”?,110,21,what think gay men say jealou straight girl easi male attent get,1
,Have you ever encountered someone and felt a chilling dread as if they were evil? What was the encounter like and did your instincts turn out to be true?,153,29,have ever encount someon felt chill dread evil what encount like instinct turn true,1
,What do you think of the concept of free will?,46,10,what think concept free,1
,"Women dating in their 30s, what do you wish you could find in a man/woman that you think is impossibly rare but you're still looking for?",137,26,women date wish could find man woman think imposs rare still look,1
"This is something that crosses my mind whenever I come home from somewhere. I usually have a specific spot on the floor where I set my large tote purse that I use for work. On the weekends I switch to a smaller crossbody. It’s just always felt in the way, and so I’m trying to figure out a new home for it. Where do you all keep your bag when you’re at home?",Where do you keep your purse?,29,6,where keep purs,1
,Do your parents like your sigoth and why?,37,8,do parent like sigoth,1
,"What job do you need little training for (not including them training you), no degree, but pays surprisingly well??",115,19,what job need littl train includ train degre pay surprisingli well,1
"My fiance's hair is *constantly* clinging to or entwined with my clothes. Underwear, socks, shirts, you name it and I've found hairs stuck to them. More than stuck, embedded. 

Long-haired ladies of reddit, does this happen to you all the time too? Is there anything I can do to prevent this from happening so I don't spend 15 minutes every morning going over my outfit to pick the hairs off?",What do you do about hair getting caught in your clothes?,57,11,what hair get caught cloth,1
,"Women of Reddit, what is the stupidest thing you've saw a man do in order to look more manly?",93,19,women reddit stupidest thing saw man order look manli,1
"I find that I easily get “absorbed” into someone else’s life, or I try to alter the majority of my day to center around whoever it is I’m seeing and it’s a bad habit.",How do you maintain your own life while dating someone?,55,10,how maintain life date someon,1
"Women of Reddit, what are your stories about crushing hard on someone who is only interested in a FWB sort of relationship of just casual hookup while you wouldn't mind/want more (romance, actually see them or just get to know each other kind of thing)? 

Would you go for it and enjoy it as a great moment anyway or would you rather just not put your emotions through that?",Have you ever just hooked up with a crush you really like?,58,12,have ever hook crush realli like,1
"Every party or gathering I've ever been to has had maybe 1/4 of the people invited actually show up. I'm wondering so that I have a good idea for a wedding, I know the whole point of an RSVP is to give you an estimate but how accurate is it?","Married women of reddit, realistically how many people showed up to your wedding versus how many RSVP'd?",104,17,marri women reddit realist mani peopl show wed versu mani rsvp,1
,Women who dance (especially ballet): do you leak while performing? How do you handle it?,88,15,women danc especi ballet leak perform how handl,1
,Ladies who stopped shaving: what was the cause and how did it affect you?,73,14,ladi stop shave caus affect,1
,What way or ways are your favorite for getting over an ex?,58,12,what way way favorit get ex,1
"What kind of friends/friend groups are you in now? Are some of you close? Do you consider any of them family? Do you have many friend groups or a close few? Are you happy with them?

Asking partially because I'd like to get a better idea of what healthy relationships look like but also genuine;y curious.",What do you look for in a friend?,33,8,what look friend,1
,"When was the last time someone completely ""pulled the wool over your eyes""?",75,13,when last time someon complet pull wool eye,1
"So the entire gender except for one person dies, with the other gender staying intact. Last man on earth with 3.5 billion females vs last woman on earth with 3.5 billion males

Do you think they’d eventually have the same outcome, or it would be different?","What might be some differences in what would happen to a hypothetical last man on earth, compared to the last woman on earth?",125,23,what might differ would happen hypothet last man earth compar last woman earth,1
"This question is something I love to ask people, so I want to hear others thoughts.",What fashion trends/accessories do you hate the most?,53,8,what fashion trend accessori hate,1
,How far into a relationship do you wait to say ‘I love you’?,60,13,how far relationship wait say i love,1
,"To the women who didn’t like to wear sexy lingerie, but do now, what caused the change?",87,17,to women like wear sexi lingeri caus chang,1
It could be career over marriage too..,"Did you choose marriage over a career? If so, what’s your story?",64,12,did choos marriag career if stori,1
,How do you deal with people who really get under your skin on a daily basis? Ones you can't get away with like coworkers.,121,24,how deal peopl realli get skin daili basi one get away like cowork,1
,Whats the best compliment you can give to a girl when they’ve tried really hard to look their best? Friend or partner,117,22,what best compliment give girl tri realli hard look best friend partner,1
,Have you ever had a “nice girl” moment wheee you felt entitled to a relationship? How did you overcome this mentality?,118,21,have ever nice girl moment wheee felt entitl relationship how overcom mental,1
,What is the pettiest thing a close friend has ever done to you? Did you ever get even with them? If so what did you do?,119,26,what pettiest thing close friend ever done did ever get even if,1
,How do you start a conversation with a girl you haven't ever spoken to...?,74,14,how start convers girl ever spoken,1
,What do you do to work on yourself and find yourself after being in a toxic relationship?,89,17,what work find toxic relationship,1
"What do you think?

Edit: what questions would YOU ask them?",What do you think of the Democratic Presidential Debate so far?,63,11,what think democrat presidenti debat far,1
Both physicaly and how was his/her reaction when he/she knew you were smoking.,"Women who smoked during pregnancy, how did it affect your child?",64,11,women smoke pregnanc affect child,1
,"Why some women dont ask questions back on dates, but are talking a lot?",71,14,whi women dont ask question back date talk lot,1
,What's the weirdest non sexual thing you've been caught doing?,62,10,what weirdest non sexual thing caught,1
I want one!,How do you get the little female symbol next to your username?,62,12,how get littl femal symbol next usernam,1
,What is the best/worst tourist trap you have been to?,53,10,what best worst tourist trap,1
,What is the craziest encounter of 'rich kid syndrome' that you have experienced?,80,13,what craziest encount rich kid syndrom experienc,1
I don't mean loneliness but rather being by yourself with no one around. I hear it time and time again that women are cautious about going out alone for fear of harassment or worse. Is it really that bad or is it somewhat overblown? As a six foot 190lb man I honestly never felt scared going off by myself so I couldn't relate.,How scary is it being alone as a woman?,39,9,how scari alon woman,1
,How many nights per week do you spend at your S/O’s?,52,11,how mani night per week spend s o,1
,How did you chose the person/place you go to to get waxed?,58,12,how chose person place go get wax,1
,What are some things moms should know when raising a girl?,58,11,what thing mom know rais girl,1
I missed spelled Sundae!,If you were an Ice Cream Sunday what would be your name and how are you made?,77,17,if ice cream sunday would name made,1
"While slut shaming is still a big issue in society, I've been seeing more prude shaming lately in response to the sex positivity movement. Has anyone shamed you for not being what they believe is sexually open? Why do you think this is becoming more popular?","What is your experience with ""prude shaming""",44,7,what experi prude shame,1
,"Ladies, how do you manage to get over the midday slump?",55,11,ladi manag get midday slump,1
,Women who married their friend's ex or know someone who did. What's your story?,79,14,women marri friend ex know someon what stori,1
,"Women who have recurring dreams about exes, what do you think those dreams mean?",80,14,women recur dream exe think dream mean,1
,"How do beauty influencers who know one has ever heard of, make it so big?",73,15,how beauti influenc know one ever heard make big,1
,"When your thoughts drift away, what is it you are usually thinking about?",73,13,when thought drift away usual think,1
,What is the best haircut for a man with a big forehead?,55,12,what best haircut man big forehead,1
,How can you get rid of stretch marks from gaining weight?,57,11,how get rid stretch mark gain weight,1
And what was the outcome of it?,What was the worst argument you had with your sigoth?,49,10,what worst argument sigoth,1
,"How do you respond to whistles, catcalls, etc.?",47,8,how respond whistl catcal etc,1
